canto,stanza_num,stanza_lines,stanza_chars,line,line_num,line_chars
Canto VIII,14,45,1673,De saber que fim tinham e onde estavam,13,38
Canto VIII,14,45,1673,As derradeiras praias que lavavam.,14,34
Canto VIII,14,45,1673,«Conceito dino foi do ramo claro,15,32
Canto VIII,14,45,1673,Do venturoso Rei que arou primeiro,16,34
Canto VIII,14,45,1673,"O mar, por ir deitar do ninho caro",17,34
Canto VIII,14,45,1673,O morador de Abila derradeiro;,18,30
Canto VIII,14,45,1673,"Este, por sua indústria e engenho raro,",19,39
Canto VIII,14,45,1673,"Num madeiro ajuntando outro madeiro,",20,36
Canto VIII,14,45,1673,Descobrir pôde a parte que faz clara,21,36
Canto VIII,14,45,1673,"De Argos, da Hidra a luz, da Lebre e da Ara.",22,44
Canto VIII,14,45,1673,«Crescendo cos sucessos bons primeiros,23,38
Canto VIII,14,45,1673,"No peito as ousadias, descobriram,",24,34
Canto VIII,14,45,1673,"Pouco e pouco, caminhos estrangeiros,",25,37
Canto VIII,14,45,1673,"Que, uns sucedendo aos outros, prosseguiram.",26,44
Canto VIII,14,45,1673,De África os moradores derradeiros,27,34
Canto VIII,14,45,1673,"Austrais, que nunca as Sete Flamas viram,",28,41
Canto VIII,14,45,1673,"Foram vistos de nós, atrás deixando",29,35
Canto VIII,14,45,1673,Quantos estão os Trópicos queimando.,30,36
Canto VIII,14,45,1673,"«Assi, com firme peito e com tamanho",31,36
Canto VIII,14,45,1673,"Propósito vencemos a Fortuna,",32,29
Canto VIII,14,45,1673,Até que nós no teu terreno estranho,33,35
Canto VIII,14,45,1673,Viemos pôr a última coluna.,34,27
Canto VIII,14,45,1673,"Rompendo a força do líquido estanho,",35,36
Canto VIII,14,45,1673,"Da tempestade horrífica e importuna,",36,36
Canto VIII,14,45,1673,"A ti chegámos, de quem só queremos",37,34
Canto VIII,14,45,1673,Sinal que ao nosso Rei de ti levemos.,38,37
Canto VIII,14,45,1673,"«Esta é a verdade, Rei; que não faria",39,37
Canto VIII,14,45,1673,"Por tão incerto bem, tão fraco prémio,",40,38
Canto VIII,14,45,1673,"Qual, não sendo isto assi, esperar podia,",41,41
Canto VIII,14,45,1673,"Tão longo, tão fingido e vão proémio;",42,37
Canto VIII,14,45,1673,Mas antes descansar me de ixaria,43,32
Canto VIII,14,45,1673,No nunca descansado e fero grémio,44,33
Canto VIII,14,45,1673,"Da madre Tétis, qual pirata inico,",45,34
Canto VIII,15,44,1579,Dos trabalhos alheios feito rico.,1,33
Canto VIII,15,44,1579,"«Assi que, ó Rei, se minha grão verdade",2,39
Canto VIII,15,44,1579,"Tens por qual é, sincera e não dobrada,",3,39
Canto VIII,15,44,1579,"Ajunta-me ao despacho brevidade,",4,32
Canto VIII,15,44,1579,Não me impidas o gosto da tornada;,5,34
Canto VIII,15,44,1579,"E, se inda te parece falsidade,",6,31
Canto VIII,15,44,1579,"Cuida bem na razão que está provada,",7,36
Canto VIII,15,44,1579,"Que com claro juízo pode ver-se,",8,32
Canto VIII,15,44,1579,Que fácil é a verdade d'entender-se.»,9,37
Canto VIII,15,44,1579,A tento estava o Rei na segurança,10,33
Canto VIII,15,44,1579,Com que provava o Gama o que dizia;,11,35
Canto VIII,15,44,1579,"Concebe dele certa confiança,",12,29
Canto VIII,15,44,1579,"Crédito firme, em quanto proferia;",13,34
Canto VIII,15,44,1579,"Pondera das palavras a abastança,",14,33
Canto VIII,15,44,1579,"Julga na autoridade grão valia,",15,31
Canto VIII,15,44,1579,Começa de julgar por enganados,16,30
Canto VIII,15,44,1579,"Os Catuais corrutos, mal julgados.",17,34
Canto VIII,15,44,1579,"Juntamente, a cobiça do proveito",18,32
Canto VIII,15,44,1579,Que espera do contrato Lusitano,19,31
Canto VIII,15,44,1579,O faz obedecer e ter respeito.,20,30
Canto VIII,15,44,1579,"Co Capitão, e não co Mauro engano.",21,34
Canto VIII,15,44,1579,Enfim ao Gama manda que direito,22,31
Canto VIII,15,44,1579,"As naus se vá e, seguro dalgum dano,",23,36
Canto VIII,15,44,1579,Possa a terra mandar qualquer fazenda,24,37
Canto VIII,15,44,1579,Que pela especiaria troque e venda.,25,35
Canto VIII,15,44,1579,"Que mande da fazenda, enfim, lhe manda",26,38
Canto VIII,15,44,1579,"Que nos Reinos Gangéticos faleça,",27,33
Canto VIII,15,44,1579,S'algüa traz idónea lá da banda,28,31
Canto VIII,15,44,1579,Donde a terra se acaba e o mar começa.,29,38
Canto VIII,15,44,1579,Já da real presença veneranda,30,29
Canto VIII,15,44,1579,"Se parte o Capitão, pera onde peça",31,34
Canto VIII,15,44,1579,"Ao Catual que dele tinha cargo,",32,31
Canto VIII,15,44,1579,"Embarcação, que a sua está de largo.",33,36
Canto VIII,15,44,1579,"Embarcação que o leve às naus lhe pede,",34,39
Canto VIII,15,44,1579,"Mas o mau Regedor, que novos laços",35,34
Canto VIII,15,44,1579,"Lhe maquinava, nada lhe concede,",36,32
Canto VIII,15,44,1579,Interpondo tardanças e embaraços.,37,33
Canto VIII,15,44,1579,"Co ele parte ao cais, por que o arrede",38,38
Canto VIII,15,44,1579,"Longe quanto puder dos régios paços,",39,36
Canto VIII,15,44,1579,"Onde, sem que seu Rei tenha notícia",40,35
Canto VIII,15,44,1579,Faça o que lhe ensinar sua malícia.,41,35
Canto VIII,15,44,1579,Lá bem longe lhe diz que lhe daria,42,34
Canto VIII,15,44,1579,"Embarcação bastante em que partisse,",43,36
Canto VIII,15,44,1579,Ou que pera a luz crástina do dia,44,33
Canto VIII,16,45,1614,"Futuro, sua partida diferisse.",1,30
Canto VIII,16,45,1614,Já com tantas tardanças entendia,2,32
Canto VIII,16,45,1614,O Gama que o Gentio consentisse,3,31
Canto VIII,16,45,1614,"Na má tenção dos Mouros, torpe e fera,",4,38
Canto VIII,16,45,1614,O que dele até'li não entendera.,5,32
Canto VIII,16,45,1614,Era este Catual um dos que estavam,6,34
Canto VIII,16,45,1614,"Corrutos pela Maumetana gente,",7,30
Canto VIII,16,45,1614,O principal por quem se governavam,8,34
Canto VIII,16,45,1614,As cidades do Samorim potente.,9,30
Canto VIII,16,45,1614,Dele sòmente os Mouros esperavam,10,32
Canto VIII,16,45,1614,Efeito a seus enganos torpemente;,11,33
Canto VIII,16,45,1614,"Ele, que no concerto vil conspira,",12,34
Canto VIII,16,45,1614,De suas esperanças não delira.,13,30
Canto VIII,16,45,1614,O Gama com instância lhe requer,14,31
Canto VIII,16,45,1614,"Que o mande pôr nas naus, e não lhe val;",15,40
Canto VIII,16,45,1614,"E que assi lho mandara, lhe refere,",16,35
Canto VIII,16,45,1614,O nobre sucessor de Perimal.,17,28
Canto VIII,16,45,1614,Por que razão lhe impede e lhe difere,18,37
Canto VIII,16,45,1614,A fazenda trazer de Portugal?,19,29
Canto VIII,16,45,1614,Pois aquilo que os Reis já têm mandado,20,38
Canto VIII,16,45,1614,Não pode ser por outrem derrogado.,21,34
Canto VIII,16,45,1614,Pouco obedece o Catual corruto,22,30
Canto VIII,16,45,1614,"A tais palavras; antes, revolvendo",23,34
Canto VIII,16,45,1614,Na fantasia algum sutil e astuto,24,32
Canto VIII,16,45,1614,"Engano diabólico e estupendo,",25,29
Canto VIII,16,45,1614,Ou como banhar possa o ferro bruto,26,34
Canto VIII,16,45,1614,"No sangue avorrecido, estava vendo,",27,35
Canto VIII,16,45,1614,"Ou como as naus em fogo lhe abrasasse,",28,38
Canto VIII,16,45,1614,Por que nenhüa à pátria mais tornasse.,29,38
Canto VIII,16,45,1614,Que nenhum torne à pátria só pretende,30,37
Canto VIII,16,45,1614,"O conselho infernal dos Maumetanos,",31,35
Canto VIII,16,45,1614,Por que não saiba nunca onde se estende,32,39
Canto VIII,16,45,1614,A terra Eoa o Rei dos Lusitanos.,33,32
Canto VIII,16,45,1614,"Não parte o Gama, enfim, que lho defende",34,40
Canto VIII,16,45,1614,O Regedor dos Bárbaros profanos;,35,32
Canto VIII,16,45,1614,"Nem sem licença sua ir-se podia,",36,32
Canto VIII,16,45,1614,Que as almadias todas lhe tolhia.,37,33
Canto VIII,16,45,1614,Aos brados e razões do Capitão,38,30
Canto VIII,16,45,1614,"Responde o Idolátra, que mandasse",39,33
Canto VIII,16,45,1614,"Chegar à terra as naus, que longe estão,",40,40
Canto VIII,16,45,1614,Por que milhor dali fosse e tornasse.,41,37
Canto VIII,16,45,1614,- «Sinal é de inimigo e de ladrão,42,33
Canto VIII,16,45,1614,"Que lá tão longe a frota se alargasse,",43,38
Canto VIII,16,45,1614,"(Lhe diz), porque do certo e fido amigo",44,39
Canto VIII,16,45,1614,É não temer do seu nenhum perigo.»,45,34
Canto VIII,17,44,1547,Nestas palavras o discreto Gama,1,31
Canto VIII,17,44,1547,Enxerga bem que as naus deseja perto,2,36
Canto VIII,17,44,1547,"O Catual, por que com ferro e flama",3,35
Canto VIII,17,44,1547,"Lhas assalte, por ódio descoberto.",4,34
Canto VIII,17,44,1547,Em vários pensamentos se derrama;,5,33
Canto VIII,17,44,1547,Fantasiando está remédio certo,6,30
Canto VIII,17,44,1547,Que desse a quanto mal se lhe ordenava;,7,39
Canto VIII,17,44,1547,"Tudo temia, tudo, enfim, cuidava.",8,33
Canto VIII,17,44,1547,Qual o reflexo lume do polido,9,29
Canto VIII,17,44,1547,"Espelho de aço ou de cristal fermoso,",10,37
Canto VIII,17,44,1547,"Que, do raio solar sendo ferido,",11,32
Canto VIII,17,44,1547,"Vai ferir noutra parte, luminoso,",12,33
Canto VIII,17,44,1547,"E, sendo da ouciosa mão movido,",13,31
Canto VIII,17,44,1547,"Pela casa, do moço curioso,",14,27
Canto VIII,17,44,1547,Anda pelas paredes e telhado,15,28
Canto VIII,17,44,1547,"Trémulo, aqui e ali, e dessossegado:",16,36
Canto VIII,17,44,1547,Tal o vago juizo fluctuava,17,26
Canto VIII,17,44,1547,"Do Gama preso, quando lhe lembrara",18,34
Canto VIII,17,44,1547,"Coelho, se por acaso o esperava",19,31
Canto VIII,17,44,1547,"Na praia cos batéis, como ordenara.",20,35
Canto VIII,17,44,1547,Logo secretamente lhe mandava,21,29
Canto VIII,17,44,1547,"Que se tornasse à frota, que deixara,",22,37
Canto VIII,17,44,1547,Não fosse salteado dos enganos,23,30
Canto VIII,17,44,1547,Que esperava dos feros Maumetanos.,24,34
Canto VIII,17,44,1547,"Tal há-de ser quem quer, co dom de Marte,",25,41
Canto VIII,17,44,1547,Imitar os Ilustres e igualá-los:,26,32
Canto VIII,17,44,1547,"Voar co pensamento a toda parte,",27,32
Canto VIII,17,44,1547,"Adivinhar perigos e evitá-los,",28,30
Canto VIII,17,44,1547,"Com militar engenho e sutil arte,",29,33
Canto VIII,17,44,1547,"Entender os imigos e enganá-los,",30,32
Canto VIII,17,44,1547,"Crer tudo, enfim; que nunca louvarei",31,36
Canto VIII,17,44,1547,O capitão que diga: «Não cuidei.»,32,33
Canto VIII,17,44,1547,Insiste o Malabar em tê-lo preso,33,32
Canto VIII,17,44,1547,Se neo manda chegar a terra a armada;,34,37
Canto VIII,17,44,1547,"Ele, constante e de ira nobre aceso,",35,36
Canto VIII,17,44,1547,Os ameaços seus não teme nada;,36,30
Canto VIII,17,44,1547,Que antes quer sobre si tomar o peso,37,36
Canto VIII,17,44,1547,De quanto mal a vil malícia ousada,38,34
Canto VIII,17,44,1547,"Lhe andar armando, que pôr em ventura",39,37
Canto VIII,17,44,1547,"A frota de seu Rei, que tem segura.",40,35
Canto VIII,17,44,1547,Aquela noite esteve ali detido,41,30
Canto VIII,17,44,1547,"E parte do outro dia, quando ordena",42,35
Canto VIII,17,44,1547,De se tornar ao Rei; mas impedido,43,33
Canto VIII,17,44,1547,"Foi da guarda que tinha, não pequena.",44,37
Canto VIII,18,44,1590,"Comete-lhe o Gentio outro partido,",1,34
Canto VIII,18,44,1590,Temendo de seu Rei castigo ou pena,2,34
Canto VIII,18,44,1590,"Se sabe esta malícia, a qual asinha",3,35
Canto VIII,18,44,1590,"Saberá, se mais tempo ali o detinha.",4,36
Canto VIII,18,44,1590,Diz-lhe que mande vir toda a fazenda,5,36
Canto VIII,18,44,1590,"Vendíbil que trazia, pera a terra,",6,34
Canto VIII,18,44,1590,"Pera que, devagar, se troque e venda;",7,37
Canto VIII,18,44,1590,"Que, quem não quer comércio, busca guerra.",8,42
Canto VIII,18,44,1590,Posto que os maus propó sitos entenda,9,37
Canto VIII,18,44,1590,"O Gama, que o danado peito encerra,",10,35
Canto VIII,18,44,1590,"Consente, porque sabe por verdade",11,33
Canto VIII,18,44,1590,Que compra co a fazenda a liberdade.,12,36
Canto VIII,18,44,1590,Concertam-se que o Negro mande dar,13,34
Canto VIII,18,44,1590,Embarcações idóneas com que venha;,14,34
Canto VIII,18,44,1590,Que os seus batéis não quer aventurar,15,37
Canto VIII,18,44,1590,"Onde lhos tome o imigo, ou lhos detenha.",16,40
Canto VIII,18,44,1590,Partem as almadias a buscar,17,27
Canto VIII,18,44,1590,Mercadoria Hispana que convenha;,18,32
Canto VIII,18,44,1590,Escreve a seu irmão que lhe mandasse,19,36
Canto VIII,18,44,1590,A fazenda com que se resgatasse.,20,32
Canto VIII,18,44,1590,"Vem a fazenda a terra, aonde logo",21,33
Canto VIII,18,44,1590,A agasalhou o infame Catual;,22,28
Canto VIII,18,44,1590,"Co ela ficam Álvaro e Diogo,",23,28
Canto VIII,18,44,1590,Que a pudessem vender pelo que val.,24,35
Canto VIII,18,44,1590,"Se mais que obrigação, que mando e rogo,",25,40
Canto VIII,18,44,1590,"No peito vil o prémio pode e val,",26,33
Canto VIII,18,44,1590,"Bem o mostra o Gentio a quem o entenda,",27,39
Canto VIII,18,44,1590,Pois o Gama soltou pela fazenda.,28,32
Canto VIII,18,44,1590,"Por ela o solta, crendo que ali tinha",29,37
Canto VIII,18,44,1590,"Penhor bastante, donde recebesse",30,32
Canto VIII,18,44,1590,Interesse maior do que lhe vinha,31,32
Canto VIII,18,44,1590,Se o Capitão mais tempo detivesse.,32,34
Canto VIII,18,44,1590,"Ele, vendo que já lhe não convinha",33,34
Canto VIII,18,44,1590,"Tornar a terra, por que não pudesse",34,35
Canto VIII,18,44,1590,"Ser mais retido, sendo às naus chegado",35,38
Canto VIII,18,44,1590,Nelas estar se deixa descansado.,36,32
Canto VIII,18,44,1590,"Nas naus estar se deixa, vagaroso,",37,34
Canto VIII,18,44,1590,Até ver o que o tempo lhe descobre;,38,35
Canto VIII,18,44,1590,Que não se fia já do cobiçoso,39,29
Canto VIII,18,44,1590,"Regedor, corrompido e pouco nobre.",40,34
Canto VIII,18,44,1590,Veja agora o juízo curioso,41,26
Canto VIII,18,44,1590,"Quanto no rico, assi como no pobre,",42,35
Canto VIII,18,44,1590,Pode o vil interesse e sede imiga,43,33
Canto VIII,18,44,1590,"Do dinheiro, que a tudo nos obriga.",44,35
Canto VIII,19,24,875,"A Polidoro mata o Rei Treício,",1,30
Canto VIII,19,24,875,Só por ficar senhor do grão tesouro;,2,36
Canto VIII,19,24,875,"Entra, pelo fortíssimo edifício,",3,32
Canto VIII,19,24,875,Com a filha de Acriso a chuva d'ouro;,4,37
Canto VIII,19,24,875,Pode tanto em Tarpeia avaro vício,5,33
Canto VIII,19,24,875,"Que, a troco do metal luzente e louro,",6,38
Canto VIII,19,24,875,"Entrega aos inimigos a alta torre,",7,34
Canto VIII,19,24,875,Do qual quási afogada em pago morre.,8,36
Canto VIII,19,24,875,Este rende munidas fortalezas;,9,30
Canto VIII,19,24,875,Faz trédoros e falsos os amigos;,10,32
Canto VIII,19,24,875,"Este a mais nobres faz fazer vilezas,",11,37
Canto VIII,19,24,875,E entrega Capitães aos inimigos;,12,32
Canto VIII,19,24,875,"Este corrompe virginais purezas,",13,32
Canto VIII,19,24,875,Sem temer de honra ou fama alguns perigos;,14,42
Canto VIII,19,24,875,"Este deprava às vezes as ciências,",15,34
Canto VIII,19,24,875,Os juízos cegando e as consciências.,16,36
Canto VIII,19,24,875,Este interpreta mais que sutilmente,17,35
Canto VIII,19,24,875,Os textos; este faz e desfaz leis;,18,34
Canto VIII,19,24,875,Este causa os perjúrios entre a gente,19,37
Canto VIII,19,24,875,E mil vezes tiranos torna os Reis.,20,34
Canto VIII,19,24,875,Até os que só a Deus omnipotente,21,32
Canto VIII,19,24,875,"Se dedicam, mil vezes ouvireis",22,30
Canto VIII,19,24,875,"Que corrompe este encantador, e ilude;",23,38
Canto VIII,19,24,875,"Mas não sem cor, contudo, de virtude!",24,38
Canto IX,1,16,566,"Tiveram longamente na cidade,",1,29
Canto IX,1,16,566,"Sem vender-se, a fazenda os dous feitores,",2,42
Canto IX,1,16,566,"Que os Infiéis, por manha e falsidade,",3,38
Canto IX,1,16,566,Fazem que não lha comprem mercadores;,4,37
Canto IX,1,16,566,Que todo seu propósito e vontade,5,32
Canto IX,1,16,566,Era deter ali os descobridores,6,30
Canto IX,1,16,566,Da Índia tanto tempo que viessem,7,32
Canto IX,1,16,566,"De Meca as naus, que as suas desfizessem.",8,41
Canto IX,1,16,566,"Lá no seio Eritreu, onde fundada",9,32
Canto IX,1,16,566,Arsínoe foi do Egípcio Ptolomeu,10,31
Canto IX,1,16,566,"(Do nome da irmã sua assi chamada,",11,34
Canto IX,1,16,566,"Que despois em Suez se converteu),",12,34
Canto IX,1,16,566,Não longe o porto jaz da nomeada,13,32
Canto IX,1,16,566,"Cidade Meca, que se engrandeceu",14,31
Canto IX,1,16,566,Com a superstição falsa e profana,15,33
Canto IX,1,16,566,Da religiosa água Maumetana.,16,28
Canto IX,2,44,1558,Gidá se chama o porto aonde o trato,1,35
Canto IX,2,44,1558,"De todo o Roxo Mar mais florecia,",2,33
Canto IX,2,44,1558,De que tinha proveito grande e grato,3,36
Canto IX,2,44,1558,O Soldão que esse Reino possuía.,4,32
Canto IX,2,44,1558,"Daqui aos Malabares, por contrato",5,33
Canto IX,2,44,1558,"Dos Infiéis, fermosa companhia",6,30
Canto IX,2,44,1558,"De grandes naus, pelo Índico Oceano,",7,36
Canto IX,2,44,1558,Especiaria vem buscar cada ano.,8,31
Canto IX,2,44,1558,"Por estas naus os Mouros esperavam,",9,35
Canto IX,2,44,1558,"Que, como fossem grandes e possantes,",10,37
Canto IX,2,44,1558,"Aquelas que o comércio lhe tomavam,",11,35
Canto IX,2,44,1558,Com flamas abrasassem crepitantes.,12,34
Canto IX,2,44,1558,Neste socorro tanto confiavam,13,29
Canto IX,2,44,1558,Que já não querem mais dos navegantes,14,37
Canto IX,2,44,1558,Senão que tanto tempo ali tardassem,15,35
Canto IX,2,44,1558,Que da famosa Meca as naus chegassem.,16,37
Canto IX,2,44,1558,"Mas o Governador dos Céus e gentes,",17,35
Canto IX,2,44,1558,"Que, pera quanto tem determinado,",18,33
Canto IX,2,44,1558,De longe os meios dá convenientes,19,33
Canto IX,2,44,1558,"Por onde vem a efeito o fim fadado,",20,35
Canto IX,2,44,1558,Influiu piadosos acidentes,21,26
Canto IX,2,44,1558,"De afeição em Monçaide, que guardado",22,36
Canto IX,2,44,1558,Estava pera dar ao Gama aviso,23,29
Canto IX,2,44,1558,E merecer por isso o Paraíso.,24,29
Canto IX,2,44,1558,"Este, de quem se os Mouros não guardavam",25,40
Canto IX,2,44,1558,Por ser Mouro como eles (antes era,26,34
Canto IX,2,44,1558,"Participante em quanto maquinavam),",27,35
Canto IX,2,44,1558,A tenção lhe descobre torpe e fera.,28,35
Canto IX,2,44,1558,Muitas vezes as naus que longe estavam,29,38
Canto IX,2,44,1558,"Visita, e com piedade considera",30,31
Canto IX,2,44,1558,O dano sem razão que se lhe ordena,31,34
Canto IX,2,44,1558,Pela maligna gente Sarracena.,32,29
Canto IX,2,44,1558,Informa o cauto Gama das armadas,33,32
Canto IX,2,44,1558,"Que de Arábica Meca vem cad'ano,",34,32
Canto IX,2,44,1558,"Que agora são dos seus tão desejadas,",35,37
Canto IX,2,44,1558,Pera ser instrumento deste dano;,36,32
Canto IX,2,44,1558,Diz-lhe que vêm de gente carregadas,37,35
Canto IX,2,44,1558,"E dos trovões horrendos de Vulcano,",38,35
Canto IX,2,44,1558,"E que pode ser delas oprimido,",39,30
Canto IX,2,44,1558,Segundo estava mal apercebido.,40,30
Canto IX,2,44,1558,"O Gama, que também considerava",41,30
Canto IX,2,44,1558,"O tempo que pera a partida o chama,",42,35
Canto IX,2,44,1558,E que despacho já não esperava,43,30
Canto IX,2,44,1558,"Milhor do Rei, que os Maumetanos ama,",44,37
Canto IX,3,44,1623,"Aos feitores que em terra estão, mandava",1,40
Canto IX,3,44,1623,"Que se tornem às naus; e, por que a fama",2,40
Canto IX,3,44,1623,"Desta súbita vinda os não impida,",3,33
Canto IX,3,44,1623,Lhe manda que a fizessem escondida.,4,35
Canto IX,3,44,1623,"Porém não tardou muito que, voando,",5,35
Canto IX,3,44,1623,"Um rumor não soasse, com verdade:",6,33
Canto IX,3,44,1623,"Que foram presos os feitores, quando",7,36
Canto IX,3,44,1623,Foram sentidos vir-se da cidade.,8,32
Canto IX,3,44,1623,Esta fama as orelhas penetrando,9,31
Canto IX,3,44,1623,"Do sábio Capitão, com brevidade",10,31
Canto IX,3,44,1623,Faz represária nuns que às naus vieram,11,38
Canto IX,3,44,1623,A vender pedraria que trouxeram.,12,32
Canto IX,3,44,1623,Eram estes antigos mercadores,13,29
Canto IX,3,44,1623,Ricos em Calecu e conhecidos;,14,29
Canto IX,3,44,1623,"Da falta deles, logo entre os milhores",15,38
Canto IX,3,44,1623,Sentido foi que estão no mar retidos.,16,37
Canto IX,3,44,1623,Mas já nas naus os bons trabalhadores,17,37
Canto IX,3,44,1623,"Volvem o cabrestante e, repartidos",18,34
Canto IX,3,44,1623,"Pelo trabalho, uns puxam pela amarra,",19,37
Canto IX,3,44,1623,"Outros quebram co peito duro a barra,",20,37
Canto IX,3,44,1623,Outros pendem da verga e já desatam,21,35
Canto IX,3,44,1623,"A vela, que com grita se soltava,",22,33
Canto IX,3,44,1623,"Quando, com maior grita, ao Rei relatam",23,39
Canto IX,3,44,1623,A pressa com que a armada se levava.,24,36
Canto IX,3,44,1623,"As mulheres e filhos, que se matam,",25,35
Canto IX,3,44,1623,"Daqueles que vão presos, onde estava",26,36
Canto IX,3,44,1623,O Samorim se aqueixam que perdidos,27,34
Canto IX,3,44,1623,"Uns têm os pais, as outras os maridos.",28,38
Canto IX,3,44,1623,Manda logo os feitores Lusitanos,29,32
Canto IX,3,44,1623,"Com toda sua fazenda, livremente,",30,33
Canto IX,3,44,1623,"Apesar dos imigos Maumetanos,",31,29
Canto IX,3,44,1623,Por que lhe torne a sua presa gente.,32,36
Canto IX,3,44,1623,Desculpas manda o Rei de seus enganos;,33,38
Canto IX,3,44,1623,Recebe o Capitão de melhormente,34,31
Canto IX,3,44,1623,"Os presos que as desculpas e, tornando",35,38
Canto IX,3,44,1623,"Alguns negros, se parte, as velas dando.",36,40
Canto IX,3,44,1623,"Parte-se costa abaxo, porque entende",37,36
Canto IX,3,44,1623,Que em vão co Rei gentio trabalhava,38,35
Canto IX,3,44,1623,"Em querer dele paz, a qual pretende",39,35
Canto IX,3,44,1623,Por firmar o comércio que tratava;,40,34
Canto IX,3,44,1623,"Mas como aquela terra, que se estende",41,37
Canto IX,3,44,1623,"Pela Aurora, sabida já deixava,",42,31
Canto IX,3,44,1623,"Com estas novas torna à pátria cara,",43,36
Canto IX,3,44,1623,Certos sinais levando do que achara.,44,36
Canto IX,4,43,1551,"Leva alguns Malabares, que tomou",1,32
Canto IX,4,43,1551,"Per força, dos que o Samorim mandara",2,36
Canto IX,4,43,1551,Quando os presos feitores lhe tornou;,3,37
Canto IX,4,43,1551,"Leva pimenta ardente, que comprara;",4,35
Canto IX,4,43,1551,A seca flor de Banda não ficou;,5,31
Canto IX,4,43,1551,"A noz e o negro cravo, que faz clara",6,36
Canto IX,4,43,1551,"A nova ilha Maluco, co a canela",7,31
Canto IX,4,43,1551,"Com que Ceilão é rica, ilustre e bela.",8,38
Canto IX,4,43,1551,Isto tudo lhe houvera a diligência,9,34
Canto IX,4,43,1551,"De Monçaide fiel, que também leva,",10,34
Canto IX,4,43,1551,"Que, inspirado de Angélica influência,",11,38
Canto IX,4,43,1551,Quer no livro de Cristo que se escreva.,12,39
Canto IX,4,43,1551,"Oh, ditoso Africano, que a clemência",13,36
Canto IX,4,43,1551,"Divina assi tirou de escura treva,",14,34
Canto IX,4,43,1551,E tão longe da pátria achou maneira,15,35
Canto IX,4,43,1551,Pera subir à pátria verdadeira!,16,31
Canto IX,4,43,1551,Apartadas assi da ardente costa,17,31
Canto IX,4,43,1551,"As venturosas naus, levando a proa",18,34
Canto IX,4,43,1551,Pera onde a Natureza tinha posta,19,32
Canto IX,4,43,1551,"A meta Austrina da Esperança Boa,",20,33
Canto IX,4,43,1551,Levando alegres novas e reposta,21,31
Canto IX,4,43,1551,"Da parte Oriental pera Lisboa,",22,30
Canto IX,4,43,1551,Outra vez cometendo os duros medos,23,34
Canto IX,4,43,1551,"Do mar incerto, tímidos e ledos.",24,32
Canto IX,4,43,1551,"O prazer de chegar à pátria cara,",25,33
Canto IX,4,43,1551,"A seus penates caros e parentes,",26,32
Canto IX,4,43,1551,Pera contar a peregrina e rara,27,30
Canto IX,4,43,1551,"Navegação, os vários céus e gentes;",28,35
Canto IX,4,43,1551,"Vir a lograr o prémio que ganhara,",29,34
Canto IX,4,43,1551,Por tão longos trabalhos e acidentes:,30,37
Canto IX,4,43,1551,"Cada um tem por gosto tão perfeito,",31,35
Canto IX,4,43,1551,Que o coração para ele é vaso estreito.,32,39
Canto IX,4,43,1551,"Porém a Deusa Cípria, que ordenada",33,34
Canto IX,4,43,1551,"Era, pera favor dos Lusitanos,",34,30
Canto IX,4,43,1551,"Do Padre Eterno, e por bom génio dada,",35,38
Canto IX,4,43,1551,"Que sempre os guia já de longos anos,",36,37
Canto IX,4,43,1551,"A glória por trabalhos alcançada,",37,33
Canto IX,4,43,1551,"Satisfação de bem sofridos danos,",38,33
Canto IX,4,43,1551,"Lhe andava já ordenando, e pretendia",39,36
Canto IX,4,43,1551,"Dar-lhe nos mares tristes, alegria.",40,35
Canto IX,4,43,1551,Despois de ter um pouco revolvido,41,33
Canto IX,4,43,1551,"Na mente o largo mar que navegaram,",42,35
Canto IX,4,43,1551,Os trabalhos que pelo Deus nascido,43,34
Canto IX,5,43,1525,"Nas Anfiónias Tebas se causaram,",1,32
Canto IX,5,43,1525,"Já trazia de longe no sentido,",2,30
Canto IX,5,43,1525,"Pera prémio de quanto mal passaram,",3,35
Canto IX,5,43,1525,"Buscar-lhe algum deleite, algum descanso,",4,41
Canto IX,5,43,1525,"No Reino de cristal, líquido e manso;",5,37
Canto IX,5,43,1525,"Algum repouso, enfim, com que pudesse",6,37
Canto IX,5,43,1525,Refocilar a lassa humanidade,7,28
Canto IX,5,43,1525,"Dos navegantes seus, como interesse",8,35
Canto IX,5,43,1525,Do trabalho que encurta a breve idade.,9,38
Canto IX,5,43,1525,Parece-lhe razão que conta desse,10,32
Canto IX,5,43,1525,"A seu filho, por cuja potestade",11,31
Canto IX,5,43,1525,Os Deuses faz decer ao vil terreno,12,34
Canto IX,5,43,1525,E os humanos subir ao Céu sereno.,13,33
Canto IX,5,43,1525,"Isto bem revolvido, determina",14,29
Canto IX,5,43,1525,"De ter-lhe aparelhada, lá no meio",15,33
Canto IX,5,43,1525,"Das águas, algüa ínsula divina,",16,31
Canto IX,5,43,1525,Ornada d'esmaltado e verde arreio;,17,34
Canto IX,5,43,1525,Que muitas tem no reino que confina,18,35
Canto IX,5,43,1525,"Da primeira co terreno seio,",19,28
Canto IX,5,43,1525,Afora as que possui soberanas,20,29
Canto IX,5,43,1525,Pera dentro das portas Herculanas.,21,34
Canto IX,5,43,1525,Ali quer que as aquáticas donzelas,22,34
Canto IX,5,43,1525,Esperem os fortíssimos barões,23,29
Canto IX,5,43,1525,"(Todas as que têm título de belas,",24,34
Canto IX,5,43,1525,"Glória dos olhos, dor dos corações)",25,35
Canto IX,5,43,1525,"Com danças e coreias, porque nelas",26,34
Canto IX,5,43,1525,"Influirá secretas afeições,",27,27
Canto IX,5,43,1525,Pera com mais vontade trabalharem,28,33
