canto,stanza_num,stanza_lines,stanza_chars,line,line_num,line_chars
Canto III,9,45,1598,"Defronte do inimigo Sarraceno,",22,30
Canto III,9,45,1598,"Posto que em força e gente tão pequeno,",23,39
Canto III,9,45,1598,"«Em nenhüa outra cousa confiado,",24,32
Canto III,9,45,1598,"senão no sumo Deus que o Céu regia,",25,35
Canto III,9,45,1598,"Que tão pouco era o povo bautizado,",26,35
Canto III,9,45,1598,"Que, pera um só, cem Mouros haveria.",27,36
Canto III,9,45,1598,Julga qualquer juízo sossegado,28,30
Canto III,9,45,1598,Por mais temeridade que ousadia,29,31
Canto III,9,45,1598,"Cometer um tamanho ajuntamento,",30,31
Canto III,9,45,1598,Que pera um cavaleiro houvesse cento.,31,37
Canto III,9,45,1598,"«Cinco Reis Mouros são os inimigos,",32,35
Canto III,9,45,1598,Dos quais o principal Ismar se chama;,33,37
Canto III,9,45,1598,Todos exprimentados nos perigos,34,31
Canto III,9,45,1598,"Da guerra, onde se alcança a ilustre fama.",35,42
Canto III,9,45,1598,"Seguem guerreiras damas seus amigos,",36,36
Canto III,9,45,1598,Imitando a fermosa e forte Dama,37,31
Canto III,9,45,1598,"De quem tanto os Troianos se ajudaram,",38,38
Canto III,9,45,1598,E as que o Termodonte já gostaram.,39,34
Canto III,9,45,1598,"«A matutina luz, serena e fria,",40,31
Canto III,9,45,1598,"As Estrelas do Pólo já apartava,",41,32
Canto III,9,45,1598,"Quando na Cruz o Filho de Maria,",42,32
Canto III,9,45,1598,"Amostrando-se a Afonso, o animava.",43,34
Canto III,9,45,1598,"Ele, adorando Quem lhe aparecia,",44,32
Canto III,9,45,1598,Na Fé todo inflamado assi gritava:,45,34
Canto III,10,44,1566,"- «Aos Infiéis, Senhor, aos Infiéis,",1,36
Canto III,10,44,1566,"E não a mi, que creio o que podeis!»",2,36
Canto III,10,44,1566,«Com tal milagre os ânimos da gente,3,35
Canto III,10,44,1566,"Portuguesa inflamados, levantavam",4,33
Canto III,10,44,1566,Por seu Rei natural este excelente,5,34
Canto III,10,44,1566,"Príncipe, que do peito tanto amavam;",6,36
Canto III,10,44,1566,E diante do exército potente,7,28
Canto III,10,44,1566,"Dos imigos, gritando, o céu tocavam,",8,36
Canto III,10,44,1566,"Dizendo em alta voz: - «Real, real,",9,35
Canto III,10,44,1566,"Por Afonso, alto Rei de Portugal!»",10,34
Canto III,10,44,1566,"«Qual cos gritos e vozes incitado,",11,34
Canto III,10,44,1566,"Pela montanha, o rábido moloso",12,30
Canto III,10,44,1566,"Contra o touro remete, que fiado",13,32
Canto III,10,44,1566,Na força está do corno temeroso;,14,32
Canto III,10,44,1566,"Ora pega na orelha, ora no lado,",15,32
Canto III,10,44,1566,"Latindo mais ligeiro que forçoso,",16,33
Canto III,10,44,1566,"Até que enfim, rompendo-lhe a garganta,",17,39
Canto III,10,44,1566,Do bravo a força horrenda se quebranta:,18,39
Canto III,10,44,1566,«Tal do Rei novo o estâmago acendido,19,36
Canto III,10,44,1566,"Por Deus e polo povo juntamente,",20,32
Canto III,10,44,1566,"O Bárbaro comete, apercebido",21,28
Canto III,10,44,1566,Co animoso exército rompente.,22,29
Canto III,10,44,1566,Levantam nisto os Perros o alarido,23,34
Canto III,10,44,1566,"Dos gritos; tocam a arma, ferve a gente,",24,40
Canto III,10,44,1566,"As lanças e arcos tomam, tubas soam,",25,36
Canto III,10,44,1566,Instrumentos de guerra tudo atroam!,26,35
Canto III,10,44,1566,"«Bem como quando a flama, que ateada",27,36
Canto III,10,44,1566,Foi nos áridos campos (assoprando,28,33
Canto III,10,44,1566,"O sibilante Bóreas), animada",29,28
Canto III,10,44,1566,"Co vento, o seco mato vai queimando;",30,36
Canto III,10,44,1566,"A pastoral companha, que deitada",31,32
Canto III,10,44,1566,"Co doce sono estava, despertando",32,32
Canto III,10,44,1566,"Ao estridor do fogo que se ateia,",33,33
Canto III,10,44,1566,Recolhe o fato e foge pera a aldeia:,34,36
Canto III,10,44,1566,"«Destarte o Mouro, atónito e Torvado,",35,37
Canto III,10,44,1566,Toma sem tento as armas mui depressa;,36,37
Canto III,10,44,1566,"Não foge, mas espera confiado,",37,30
Canto III,10,44,1566,E o ginete belígero arremessa.,38,30
Canto III,10,44,1566,"O Português o encontra denodado,",39,32
Canto III,10,44,1566,Pelos peitos as lanças lhe atravessa;,40,37
Canto III,10,44,1566,Uns caem meios mortos e outros vão,41,34
Canto III,10,44,1566,A ajuda convocando do Alcorão.,42,30
Canto III,10,44,1566,"«Ali se vêm encontros temerosos,",43,32
Canto III,10,44,1566,"Pera se desfazer üa alta serra,",44,31
Canto III,11,44,1609,E os animais correndo furiosos,1,30
Canto III,11,44,1609,"Que Neptuno amostrou, ferindo a terra;",2,38
Canto III,11,44,1609,Golpes se dão medonhos e forçosos;,3,34
Canto III,11,44,1609,Por toda a parte andava acesa a guerra;,4,39
Canto III,11,44,1609,"Mas o de Luso arnês, couraça e malha,",5,37
Canto III,11,44,1609,"Rompe, corta desfaz abola e talha.",6,34
Canto III,11,44,1609,"«Cabeças pelo campo vão saltando,",7,33
Canto III,11,44,1609,"Braços, pernas, sem dono e sem sentido,",8,39
Canto III,11,44,1609,"E doutros as entranhas palpitando,",9,34
Canto III,11,44,1609,"Pálida a cor, o gesto amortecido.",10,33
Canto III,11,44,1609,Já perde o campo o exército nefando;,11,36
Canto III,11,44,1609,"Correm rios do sangue desparzido,",12,33
Canto III,11,44,1609,"Com que também do campo a cor se perde,",13,39
Canto III,11,44,1609,"Tornado carmesi, de branco e verde.",14,35
Canto III,11,44,1609,"«Já fica vencedor o Lusitano,",15,29
Canto III,11,44,1609,Recolhendo os troféus e presa rica;,16,35
Canto III,11,44,1609,Desbaratado e roto o Mauro Hispano,17,34
Canto III,11,44,1609,Três dias o grão Rei no campo fica.,18,35
Canto III,11,44,1609,"Aqui pinta no branco escudo ufano,",19,34
Canto III,11,44,1609,"Que agora esta vitória certifica,",20,33
Canto III,11,44,1609,"Cinco escudos azuis esclarecidos,",21,33
Canto III,11,44,1609,Em sinal destes cinco Reis vencidos.,22,36
Canto III,11,44,1609,«E nestes cinco escudos pinta os trinta,23,39
Canto III,11,44,1609,"Dinheiros por que Deus fora vendido,",24,36
Canto III,11,44,1609,"Escrevendo a memória, em vária tinta,",25,37
Canto III,11,44,1609,Daquele de Quem foi favorecido.,26,31
Canto III,11,44,1609,"Em cada um dos cinco, cinco pinta,",27,34
Canto III,11,44,1609,"Porque assi fica o número cumprido,",28,35
Canto III,11,44,1609,"Contando duas vezes o do meio,",29,30
Canto III,11,44,1609,Dos cinco azuis que em cruz pintando veio.,30,42
Canto III,11,44,1609,«Passado já algum tempo que passada,31,35
Canto III,11,44,1609,"Era esta grão vitória, o Rei subido",32,35
Canto III,11,44,1609,"A tomar vai Leiria, que tomada",33,30
Canto III,11,44,1609,"Fora, mui pouco havia, do vencido.",34,34
Canto III,11,44,1609,Com esta a forte Arronches sojugada,35,35
Canto III,11,44,1609,Foi juntamente; e o sempre ennobrecido,36,38
Canto III,11,44,1609,"Scabelicastro, cujo campo ameno",37,31
Canto III,11,44,1609,"Tu, claro Tejo, regas tão sereno.",38,33
Canto III,11,44,1609,«A estas nobres vilas sometidas,39,31
Canto III,11,44,1609,"Ajunta também Mafra, em pouco espaço,",40,37
Canto III,11,44,1609,"E, nas serras da Lüa conhecidas,",41,32
Canto III,11,44,1609,Sojuga a fria Sintra o duro braço;,42,34
Canto III,11,44,1609,"Sintra, onde as Naiades, escondidas",43,35
Canto III,11,44,1609,"Nas fontes, vão fugindo ao doce laço",44,36
Canto III,12,44,1551,"Onde Amor as enreda brandamente,",1,32
Canto III,12,44,1551,Nas águas acendendo fogo ardente.,2,33
Canto III,12,44,1551,"«E tu, nobre Lisboa, que no mundo",3,33
Canto III,12,44,1551,"Fàcilmente das outras és princesa,",4,34
Canto III,12,44,1551,Que edificada foste do facundo,5,30
Canto III,12,44,1551,Por cujo engano foi Dardânia acesa;,6,35
Canto III,12,44,1551,Tu a quem obedece o Mar profundo,7,32
Canto III,12,44,1551,"Obedeceste à força Portuguesa,",8,30
Canto III,12,44,1551,Ajudada também da forte armada,9,30
Canto III,12,44,1551,Que das Boreais partes foi mandada.,10,35
Canto III,12,44,1551,«Lá do Germânico Álbis e do Reno,11,32
Canto III,12,44,1551,"E da fria Bretanha conduzidos,",12,30
Canto III,12,44,1551,A destruir o povo Sarraceno,13,27
Canto III,12,44,1551,Muitos com tenção santa eram partidos.,14,38
Canto III,12,44,1551,"Entrando a boca já do Tejo ameno,",15,33
Canto III,12,44,1551,"Co arraial do grande Afonso unidos,",16,35
Canto III,12,44,1551,"Cuja alta fama antão subia aos céus,",17,36
Canto III,12,44,1551,Foi posto cerco aos muros Ulisseus.,18,35
Canto III,12,44,1551,«Cinco vezes a Lüa se escondera,19,31
Canto III,12,44,1551,"E outras tantas mostrara cheio o rosto,",20,39
Canto III,12,44,1551,"Quando a cidade, entrada, se rendera",21,36
Canto III,12,44,1551,Ao duro cerco que lhe estava posto,22,34
Canto III,12,44,1551,Foi a batalha tão sanguina e fera,23,33
Canto III,12,44,1551,Quanto obrigava o firme pros[s]uposto,24,37
Canto III,12,44,1551,De vencedores ásperos e ousados,25,31
Canto III,12,44,1551,E de vencidos já desesperados.,26,30
Canto III,12,44,1551,"«Destarte, enfim, tomada se rendeu",27,34
Canto III,12,44,1551,"Aquela que, nos tempos já passados,",28,35
Canto III,12,44,1551,À grande força nunca obedeceu,29,29
Canto III,12,44,1551,"Dos frios povos Cíticos ousados,",30,32
Canto III,12,44,1551,Cujo poder a tanto se estendeu,31,30
Canto III,12,44,1551,Que o Ibero o viu e o Tejo amedrontados;,32,40
Canto III,12,44,1551,"E, enfim, co Bétis tanto alguns puderam",33,39
Canto III,12,44,1551,"Que à terra, de Vandália nome deram.",34,36
Canto III,12,44,1551,«Que cidade tão forte porventura,35,32
Canto III,12,44,1551,"Haverá que resista, se Lisboa",36,29
Canto III,12,44,1551,Não pôde resistir à força dura,37,30
Canto III,12,44,1551,Da gente cuja fama tanto voa?,38,29
Canto III,12,44,1551,"Já lhe obedece toda a Estremadura,",39,34
Canto III,12,44,1551,"Óbidos, Alanquer, por onde soa",40,30
Canto III,12,44,1551,"O tom das frescas águas entre as pedras,",41,40
Canto III,12,44,1551,"Que murmurando lava, e Torres Vedras.",42,37
Canto III,12,44,1551,"«E vós também, ó terras Transtaganas,",43,37
Canto III,12,44,1551,"Afamadas co dom da flava Ceres,",44,31
Canto III,13,45,1609,"Obedeceis às forças mais que humanas,",1,37
Canto III,13,45,1609,Entregando-lhe os muros e os poderes;,2,37
Canto III,13,45,1609,"E tu, lavrador Mouro, que te enganas,",3,37
Canto III,13,45,1609,Se sustentar a fértil terra queres:,4,35
Canto III,13,45,1609,"Que Elvas e Moura e Serpa, conhecidas,",5,38
Canto III,13,45,1609,E Alcáçare do Sal estão rendidas.,6,33
Canto III,13,45,1609,"«Eis a nobre cidade, certo assento",7,34
Canto III,13,45,1609,"Do rebelde Sertório antigamente,",8,32
Canto III,13,45,1609,Onde ora as águas nítidas de argento,9,36
Canto III,13,45,1609,Vêm sustentar de longo a terra e a gente,10,40
Canto III,13,45,1609,"Pelos arcos reais, que, cento e cento,",11,38
Canto III,13,45,1609,"Nos ares se alevantam nobremente,",12,33
Canto III,13,45,1609,Obedeceu por meio e ousadia,13,27
Canto III,13,45,1609,"De Giraldo, que medos não temia.",14,32
Canto III,13,45,1609,«Já na cidade Beja vai tomar,15,28
Canto III,13,45,1609,Vingança de Trancoso destruída,16,30
Canto III,13,45,1609,"Afonso, que não sabe sossegar,",17,30
Canto III,13,45,1609,Por estender co a fama a curta vida.,18,36
Canto III,13,45,1609,Não se lhe pode muito sustentar,19,31
Canto III,13,45,1609,"A cidade; mas, sendo já rendida,",20,32
Canto III,13,45,1609,Em toda a cousa viva a gente irada,21,34
Canto III,13,45,1609,Provando os fios vai da dura espada.,22,36
Canto III,13,45,1609,«Com estas sojugada foi Palmela,23,31
Canto III,13,45,1609,"E a piscosa Sesimbra e, juntamente,",24,35
Canto III,13,45,1609,"Sendo ajudado mais de sua estrela,",25,34
Canto III,13,45,1609,Desbarata um exército potente,26,29
Canto III,13,45,1609,"(Sentiu-o a vila e viu-o a serra dela),",27,39
Canto III,13,45,1609,Que a socorrê-la vinha diligente,28,32
Canto III,13,45,1609,"Pela fralda da serra, descuidado",29,32
Canto III,13,45,1609,Do temeroso encontro inopinado.,30,31
Canto III,13,45,1609,"«O Rei de Badajoz era, alto Mouro,",31,34
Canto III,13,45,1609,"Com quatro mil cavalos furiosos,",32,32
Canto III,13,45,1609,"Inúmeros peões, de armas e de ouro",33,34
Canto III,13,45,1609,"Guarnecidos, guerreiros e lustrosos;",34,36
Canto III,13,45,1609,"Mas, qual no mês de Maio o bravo touro,",35,39
Canto III,13,45,1609,"Cos ciú mes da vaca, arreceosos,",36,32
Canto III,13,45,1609,"Sentindo gente, o bruto e cego amante",37,37
Canto III,13,45,1609,Salteia o descuidado caminhante:,38,32
Canto III,13,45,1609,"«Destarte Afonso, súbito mostrado,",39,34
Canto III,13,45,1609,"Na gente dá, que passa bem segura;",40,34
Canto III,13,45,1609,"Fere, mata, derriba, denodado;",41,30
Canto III,13,45,1609,Foge o Rei Mouro e só da vida cura;,42,35
Canto III,13,45,1609,"Dum pânico terror todo assombrado,",43,34
Canto III,13,45,1609,Só de segui-lo o exército procura;,44,34
Canto III,13,45,1609,Sendo estes que fizeram tanto abalo,45,35
Canto III,14,44,1615,Nô mais que só sessenta de cavalo.,1,34
Canto III,14,44,1615,"«Logo segue a vitória, sem tardança,",2,36
Canto III,14,44,1615,"O grão Rei incansábil, ajuntando",3,32
Canto III,14,44,1615,"Gentes de todo o Reino, cuja usança",4,35
Canto III,14,44,1615,Era andar sempre terras conquistando.,5,37
Canto III,14,44,1615,Cercar vai Badajoz e logo alcança,6,33
Canto III,14,44,1615,"O fim de seu desejo, pelejando",7,30
Canto III,14,44,1615,"Com tanto esforço e arte e valentia,",8,36
Canto III,14,44,1615,Que a fez fazer às outras companhia.,9,36
Canto III,14,44,1615,"«Mas o alto Deus, que pera longe guarda",10,39
Canto III,14,44,1615,"O castigo daquele que o merece,",11,31
Canto III,14,44,1615,"Ou pera que se emende, às vezes tarda,",12,38
Canto III,14,44,1615,Ou por segredos que homem não conhece,13,37
Canto III,14,44,1615,Se até qui sempre o forte Rei resguarda,14,39
Canto III,14,44,1615,"Dos perigos a que ele se oferece,",15,33
Canto III,14,44,1615,Agora lhe não deixa ter defesa,16,30
Canto III,14,44,1615,Da maldição da mãe que estava presa:,17,36
Canto III,14,44,1615,"«Que, estando na cidade que cercara,",18,36
Canto III,14,44,1615,"Cercado nela foi dos Lioneses,",19,30
Canto III,14,44,1615,"Porque a conquista dela lhe tomara,",20,35
Canto III,14,44,1615,"De Lião sendo, e não dos Portugueses.",21,37
Canto III,14,44,1615,"A pertinácia aqui lhe custa cara,",22,33
Canto III,14,44,1615,"Assi como acontece muitas vezes,",23,32
Canto III,14,44,1615,"Que em ferros quebra as pernas, indo aceso",24,42
Canto III,14,44,1615,"À batalha, onde foi vencido e preso.",25,36
Canto III,14,44,1615,"«Ó famoso Pompeio, não te pene",26,30
Canto III,14,44,1615,"De teus feitos ilustres a ruína,",27,32
Canto III,14,44,1615,Nem ver que a justa Némesis ordene,28,34
Canto III,14,44,1615,"Ter teu sogro de ti vitória dina,",29,33
Canto III,14,44,1615,"Posto que o frio Fásis ou Siene,",30,32
Canto III,14,44,1615,"Que pera nenhum cabo a sombra inclina,",31,38
Canto III,14,44,1615,O Bootes gelado e a linha ardente,32,33
Canto III,14,44,1615,Temessem o teu nome geralmente.,33,31
Canto III,14,44,1615,«Posto que a rica Arábia e que os feroces,34,41
Canto III,14,44,1615,"Heníocos e Colcos, cuja fama",35,28
Canto III,14,44,1615,"O Véu dourado estende, e os Capadoces",36,37
Canto III,14,44,1615,"E Judeia, que um Deus adora e ama,",37,34
Canto III,14,44,1615,E que os moles Sofenos e os atroces,38,35
Canto III,14,44,1615,"Cilícios, com a Arménia, que derrama",39,36
Canto III,14,44,1615,As águas dos dous rios cuja fonte,40,33
Canto III,14,44,1615,"Está noutro mais alto e santo monte,",41,36
Canto III,14,44,1615,"«E posto, enfim, que desd'o mar de Atlante",42,42
Canto III,14,44,1615,"Até o Cítico Tauro, monte erguido,",43,34
Canto III,14,44,1615,"Já vencedor te vissem, não te espante",44,37
Canto III,15,45,1602,Se o campo Emátio só te viu vencido;,1,36
Canto III,15,45,1602,"Porque Afonso verás, soberbo e ovante,",2,38
Canto III,15,45,1602,Tudo render e ser despois rendido.,3,34
Canto III,15,45,1602,"Assi o quis o Conselho alto, celeste,",4,37
Canto III,15,45,1602,Que vença o sogro a ti e o genro a este!,5,40
Canto III,15,45,1602,"«Tornado o Rei sublime, finalmente,",6,35
Canto III,15,45,1602,Do divino Juízo castigado;,7,26
Canto III,15,45,1602,"Despois que em Santarém soberbamente,",8,37
Canto III,15,45,1602,"Em vão, dos Sarracenos foi cercado,",9,35
Canto III,15,45,1602,E despois que do mártire Vicente,10,32
Canto III,15,45,1602,O santíssimo corpo venerado,11,27
Canto III,15,45,1602,Do Sacro Promontório conhecido,12,30
Canto III,15,45,1602,À cidade Ulisseia foi trazido;,13,30
Canto III,15,45,1602,"«Por que levasse avante seu desejo,",14,35
Canto III,15,45,1602,Ao forte filho manda o lasso velho,15,34
Canto III,15,45,1602,"Que às terras se passasse d'Alentejo,",16,37
Canto III,15,45,1602,Com gente e co belígero aparelho.,17,33
Canto III,15,45,1602,"Sancho, d'esforço e d'ânimo sobejo,",18,35
Canto III,15,45,1602,Avante passa e faz correr vermelho,19,34
Canto III,15,45,1602,"O rio que Sevilha vai regando,",20,30
Canto III,15,45,1602,"Co sangue Mauro, bárbaro e nefando.",21,35
Canto III,15,45,1602,"«E, com esta vitória cobiçoso,",22,30
Canto III,15,45,1602,"Já não descansa o moço, até que veja",23,36
Canto III,15,45,1602,"Outro estrago como este, temeroso,",24,34
Canto III,15,45,1602,No Bárbaro que tem cercado Beja.,25,32
Canto III,15,45,1602,Não tarda muito o Príncipe ditoso,26,33
Canto III,15,45,1602,Sem ver o fim daquilo que deseja.,27,33
Canto III,15,45,1602,"Assi estragado, o Mouro na vingança",28,35
Canto III,15,45,1602,De tantas perdas põe sua esperança.,29,35
Canto III,15,45,1602,«Já se ajuntam do monte a quem Medusa,30,37
Canto III,15,45,1602,O corpo fez perder que teve o Céu;,31,34
Canto III,15,45,1602,Já vêm do promontório de Ampelusa,32,33
Canto III,15,45,1602,"E do Tinge, que assento foi de Anteu.",33,37
Canto III,15,45,1602,"O morador de Abila não se escusa,",34,33
Canto III,15,45,1602,"Que também com suas armas se moveu,",35,35
Canto III,15,45,1602,"Ao som da Mauritana e ronca tuba,",36,33
Canto III,15,45,1602,Todo o Reino que foi do nobre Juba.,37,35
Canto III,15,45,1602,"«Entrava, com toda esta companhia,",38,34
Canto III,15,45,1602,O Miralmomini em Portugal;,39,26
Canto III,15,45,1602,"Treze Reis mouros leva de valia,",40,32
Canto III,15,45,1602,Entre os quais tem o ceptro Imperial.,41,37
Canto III,15,45,1602,"E assi, fazendo quanto mal podia,",42,33
Canto III,15,45,1602,"O que em partes podia fazer mal,",43,32
Canto III,15,45,1602,Dom Sancho vai cercar em Santarém;,44,34
Canto III,15,45,1602,Porém não lhe sucede muito bem.,45,31
Canto III,16,44,1556,"«Dá-lhe combates ásperos, fazendo",1,33
Canto III,16,44,1556,"Ardis de guerra mil, o Mouro iroso;",2,35
Canto III,16,44,1556,"Não lhe aproveita já trabuco horrendo,",3,38
Canto III,16,44,1556,"Mina secreta, aríete forçoso;",4,29
Canto III,16,44,1556,"Porque o filho de Afonso, não perdendo",5,38
Canto III,16,44,1556,"Nada do esforço e acordo generoso,",6,34
Canto III,16,44,1556,"Tudo provê com ânimo e prudência,",7,33
Canto III,16,44,1556,Que em toda a parte há esforço e resistência.,8,45
Canto III,16,44,1556,"«Mas o velho, a quem tinham já obrigado",9,39
Canto III,16,44,1556,"Os trabalhosos anos ao sossego,",10,31
Canto III,16,44,1556,Estando na cidade cujo prado,11,28
Canto III,16,44,1556,"Enverdecem as águas do Mondego,",12,31
Canto III,16,44,1556,"Sabendo como o filho está cercado,",13,34
Canto III,16,44,1556,"Em Santarém, do Mauro povo cego,",14,32
Canto III,16,44,1556,Se parte diligente da cidade;,15,29
Canto III,16,44,1556,Que não perde a presteza co a idade.,16,36
Canto III,16,44,1556,"«E co a famosa gente, à guerra usada,",17,37
Canto III,16,44,1556,"Vai socorrer o filho; e assi ajuntados,",18,39
Canto III,16,44,1556,A Portuguesa fúria costumada,19,28
Canto III,16,44,1556,Em breve os Mouros tem desbaratados.,20,36
Canto III,16,44,1556,"A campina, que toda está coalhada",21,33
Canto III,16,44,1556,"De marlotas, capuzes variados,",22,30
Canto III,16,44,1556,"De cavalos, jaezes, presa rica,",23,31
Canto III,16,44,1556,De seus senhores mortos cheia fica.,24,35
Canto III,16,44,1556,«Logo todo o restante se partiu,25,31
Canto III,16,44,1556,"De Lusitânia, postos em fugida;",26,31
Canto III,16,44,1556,"O Miralmomini só não fugiu,",27,27
Canto III,16,44,1556,"Porque, antes de fugir, lhe foge a vida.",28,40
Canto III,16,44,1556,A Quem lhe esta vitória permitiu,29,32
Canto III,16,44,1556,Dão louvores e graças sem medida;,30,33
Canto III,16,44,1556,"Que, em casos tão estranhos, claramente",31,39
Canto III,16,44,1556,Mais peleja o favor de Deus que a gente.,32,40
Canto III,16,44,1556,«De tamanhas vitórias triunfava,33,31
Canto III,16,44,1556,"O velho Afonso, Príncipe subido,",34,32
Canto III,16,44,1556,"Quando quem tudo enfim vencendo andava,",35,39
Canto III,16,44,1556,Da larga e muita idade foi vencido.,36,35
Canto III,16,44,1556,"A pálida doença lhe tocava,",37,27
Canto III,16,44,1556,"Com fria mão, o corpo enfraquecido;",38,35
Canto III,16,44,1556,"E pagaram seus anos, deste jeito,",39,33
Canto III,16,44,1556,À triste Libitina seu direito.,40,30
Canto III,16,44,1556,"«Os altos promontórios o choraram,",41,34
Canto III,16,44,1556,E dos rios as águas saüdosas,42,28
Canto III,16,44,1556,"Os semeados campos alagaram,",43,28
Canto III,16,44,1556,Com lágrimas correndo piadosas;,44,31
Canto III,17,44,1548,"Mas tanto pelo mundo se alargaram,",1,34
Canto III,17,44,1548,"Com fama suas obras valerosas,",2,30
Canto III,17,44,1548,Que sempre no seu reino chamarão,3,32
Canto III,17,44,1548,«Afonso! Afonso!» os ecos; mas em vão.,4,38
Canto III,17,44,1548,"«Sancho, forte mancebo, que ficara",5,34
Canto III,17,44,1548,"Imitando seu pai na valentia,",6,29
Canto III,17,44,1548,E que em sua vida já se exprimentara,7,36
Canto III,17,44,1548,Quando o Bétis de sangue se tingia,8,34
Canto III,17,44,1548,E o bárbaro poder desbaratara,9,29
Canto III,17,44,1548,"Do Ismaelita Rei de Andaluzia,",10,30
Canto III,17,44,1548,E mais quando os que Beja em vão cercaram,11,41
Canto III,17,44,1548,Os golpes de seu braço em si provaram;,12,38
Canto III,17,44,1548,"«Despois que foi por Rei alevantado,",13,36
Canto III,17,44,1548,"Havendo poucos anos que reinava,",14,32
Canto III,17,44,1548,"A cidade de Silves tem cercado,",15,31
Canto III,17,44,1548,Cujos campos o Bárbaro lavrava.,16,31
Canto III,17,44,1548,Foi das valentes gentes ajudado,17,31
Canto III,17,44,1548,"Da Germânica armada que passava,",18,32
Canto III,17,44,1548,"De armas fortes e gente apercebida,",19,35
Canto III,17,44,1548,A recobrar Judeia já perdida.,20,29
Canto III,17,44,1548,«Passavam a ajudar na santa empresa,21,35
Canto III,17,44,1548,"O roxo Federico, que moveu",22,26
Canto III,17,44,1548,"O poderoso exército, em defesa",23,30
Canto III,17,44,1548,"Da cidade onde Cristo padeceu,",24,30
Canto III,17,44,1548,"Quando Guido, co a gente em sede acesa,",25,39
Canto III,17,44,1548,"Ao grande Saladino se rendeu,",26,29
Canto III,17,44,1548,No lugar onde aos Mouros sobejavam,27,34
Canto III,17,44,1548,As águas que os de Guido desejavam.,28,35
Canto III,17,44,1548,"«Mas a fermosa armada, que viera",29,32
Canto III,17,44,1548,"Por contraste de vento àquela parte,",30,36
Canto III,17,44,1548,"Sancho quis ajudar na guerra fera,",31,34
Canto III,17,44,1548,Já que em serviço vai do santo Marte.,32,37
Canto III,17,44,1548,Assi como a seu pai acontecera,33,30
Canto III,17,44,1548,"Quando tomou Lisboa, da mesma arte",34,34
Canto III,17,44,1548,"Do Germano ajudado, Silves toma",35,31
Canto III,17,44,1548,E o bravo morador destrui e doma.,36,33
Canto III,17,44,1548,«E se tantos troféus do Mahometa,37,32
Canto III,17,44,1548,"Alevantando vai, também do forte",38,32
Canto III,17,44,1548,Lionês não consente estar quieta,39,32
Canto III,17,44,1548,"A terra, usada aos casos de Mavorte,",40,36
Canto III,17,44,1548,Até que na cerviz seu jugo meta,41,31
Canto III,17,44,1548,"Da soberba Tuí, que a mesma sorte",42,33
Canto III,17,44,1548,"Viu ter a muitas vilas suas vizinhas,",43,37
Canto III,17,44,1548,"Que por armas tu, Sancho, humildes tinhas.",44,42
Canto III,18,45,1592,"«Mas, entre tantas palmas salteado",1,34
Canto III,18,45,1592,"Da temerosa morte, fica herdeiro",2,32
Canto III,18,45,1592,"Um filho seu, de todos estimado,",3,32
Canto III,18,45,1592,Que foi segundo Afonso e Rei terceiro.,4,38
Canto III,18,45,1592,"No tempo deste, aos Mauros foi tomado",5,37
Canto III,18,45,1592,"Alcáçare do Sal, por derradeiro;",6,32
Canto III,18,45,1592,"Porque dantes os Mouros o tomaram,",7,34
Canto III,18,45,1592,Mas agora estruídos o pagaram.,8,30
Canto III,18,45,1592,"Morto despois Afonso, lhe sucede",9,32
Canto III,18,45,1592,"Sancho segundo, manso e descuidado;",10,35
Canto III,18,45,1592,Que tanto em seus descuidos se desmede,11,38
Canto III,18,45,1592,Que de outrem quem mandava era mandado.,12,39
Canto III,18,45,1592,"De governar o Reino, que outro pede,",13,36
Canto III,18,45,1592,"Por causa dos privados foi privado,",14,35
Canto III,18,45,1592,"Porque, como por eles se regia,",15,31
Canto III,18,45,1592,Em todos os seus vícios consentia.,16,34
Canto III,18,45,1592,"«Não era Sancho, não, tão desonesto",17,35
Canto III,18,45,1592,"Como Nero, que um moço recebia",18,30
Canto III,18,45,1592,"Por mulher e, despois, horrendo incesto",19,39
Canto III,18,45,1592,Com a mãe Agripina cometia;,20,27
Canto III,18,45,1592,Nem tão cruel às gentes e molesto,21,33
Canto III,18,45,1592,Que a cidade queimasse onde vivia;,22,34
Canto III,18,45,1592,"Nem tão mau como foi Heliogabalo,",23,33
Canto III,18,45,1592,Nem como o mole Rei Sardanapalo.,24,32
Canto III,18,45,1592,"«Nem era o povo seu tiranizado,",25,31
Canto III,18,45,1592,Como Sicília foi de seus tiranos;,26,33
Canto III,18,45,1592,"Nem tinha, como Fálaris, achado",27,31
Canto III,18,45,1592,Género de tormentos inumanos;,28,29
Canto III,18,45,1592,"Mas o Reino, de altivo e costumado",29,34
Canto III,18,45,1592,"A senhores em tudo soberanos,",30,29
